{
  "schema": "srsp.plugin/1",
  "id": "org.example.minimal",
  "name": "Minimal Plugin",
  "version": "1.0.0",
  "api": "1.0",
  "kind": ["io"],
  "transport": {
    "type": "inproc",
    "library": { "linux-x86_64-gcc": "lib/libminimal.so" }
  },
  "capabilities": [
    { "name": "srsp.io/recorder", "version": "1.0", "alias": "recorder" }
  ],
  "platforms": ["linux-x86_64"]
}
